{
  "snapshot_date": "2026-10-20",
  "published_at": "2026-10-21T06:37:44+00:00",
  "n_leaderboard": 50,
  "data_through_date": "2026-10-20",
  "step_durations": {
    "ingest": 61.2,
    "build features": 84.5,
    "score": 12.1,
    "freeze": 3.4,
    "export site data": 40.8,
    "upload to hub": 22.7
  },
  "rows_ingested_last_14d": [
    {
      "event_type": "WatchEvent",
      "latest_event": "2026-10-20T23:59:41Z",
      "rows_24h": 8571,
      "missing_hours": 0
    },
    {
      "event_type": "PullRequestEvent",
      "latest_event": "2026-10-20T23:59:58Z",
      "rows_24h": 40445,
      "missing_hours": 0
    },
    {
      "event_type": "IssuesEvent",
      "latest_event": "2026-10-20T23:59:12Z",
      "rows_24h": 17140,
      "missing_hours": 1
    }
  ],
  "missing_hours": [],
  "dbt_summary": {
    "tests_passing": 162,
    "status": "clean"
  },
  "model": {
    "version": "20261019-b5ff585",
    "promoted_at": "2026-10-19T18:00:00+00:00",
    "cv_pooled_pr_auc": 0.108,
    "holdout_pr_auc": 0.158
  },
  "drift": {
    "as_of": "2026-10-20",
    "high_drift_threshold": 0.25,
    "psi_by_feature": {
      "stars_3d": 0.04,
      "actor_days_14d": 0.12,
      "primary_language": 0.31,
      "stars_7d": 0.08,
      "sg_tm_max_14d": 0.02,
      "age_days": 0.55
    }
  },
  "heartbeat": {
    "last_success_at": "2026-10-20T13:35:08.785411+00:00",
    "snapshot_date": "2026-10-20",
    "model_version": "20261019-b5ff585",
    "n_candidates": 1033,
    "runtime_seconds": 249,
    "freeze_conflict": false,
    "missing_hours_older_than_3d": 0,
    "dbt_freshness_passed": true,
    "status": "healthy"
  }
}
